[
  {
    "id": 1,
    "title": "Two Sum",
    "difficulty": "Easy",
    "url": "https://leetcode.com/problems/two-sum/",
    "tags": ["Array", "Hash Table"],
    "patterns": ["Two Pointers", "Hash Map"],
    "companies": ["Google", "Amazon", "Microsoft", "Facebook"],
    "dateAdded": "2023-01-01",
    "description": "Given an array of integers nums and an integer target, return indices of the two numbers such that they add up to target."
  },
  {
    "id": 3,
    "title": "Longest Substring Without Repeating Characters",
    "difficulty": "Medium",
    "url": "https://leetcode.com/problems/longest-substring-without-repeating-characters/",
    "tags": ["Hash Table", "String", "Sliding Window"],
    "patterns": ["Sliding Window", "Hash Map"],
    "companies": ["Google", "Amazon", "Microsoft", "Bloomberg"],
    "dateAdded": "2023-01-03",
    "description": "Given a string s, find the length of the longest substring without repeating characters."
  },
  {
    "id": 4,
    "title": "Median of Two Sorted Arrays",
    "difficulty": "Hard",
    "url": "https://leetcode.com/problems/median-of-two-sorted-arrays/",
    "tags": ["Array", "Binary Search", "Divide and Conquer"],
    "patterns": ["Binary Search"],
    "companies": ["Google", "Microsoft", "Apple"],
    "dateAdded": "2023-01-04",
    "description": "Given two sorted arrays nums1 and nums2 of size m and n respectively, return the median of the two sorted arrays."
  },
  {
    "id": 5,
    "title": "Longest Palindromic Substring",
    "difficulty": "Medium",
    "url": "https://leetcode.com/problems/longest-palindromic-substring/",
    "tags": ["String", "Dynamic Programming"],
    "patterns": ["DP", "Expand Around Centers"],
    "companies": ["Google", "Amazon", "Microsoft", "Facebook"],
    "dateAdded": "2023-01-05",
    "description": "Given a string s, return the longest palindromic substring in s."
  },
  {
    "id": 11,
    "title": "Container With Most Water",
    "difficulty": "Medium",
    "url": "https://leetcode.com/problems/container-with-most-water/",
    "tags": ["Array", "Two Pointers", "Greedy"],
    "patterns": ["Two Pointers"],
    "companies": ["Google", "Amazon", "Facebook", "Apple"],
    "dateAdded": "2023-01-11",
    "description": "You are given an integer array height of length n. Find two lines that together with the x-axis form a container that contains the most water."
  },
  {
    "id": 15,
    "title": "3Sum",
    "difficulty": "Medium",
    "url": "https://leetcode.com/problems/3sum/",
    "tags": ["Array", "Two Pointers", "Sorting"],
    "patterns": ["Two Pointers", "Sorting"],
    "companies": ["Google", "Amazon", "Microsoft", "Facebook", "Adobe"],
    "dateAdded": "2023-04-01",
    "description": "Given an integer array nums, return all the triplets [nums[i], nums[j], nums[k]] such that i != j, i != k, and j != k, and nums[i] + nums[j] + nums[k] == 0."
  },
  {
    "id": 20,
    "title": "Valid Parentheses",
    "difficulty": "Easy",
    "url": "https://leetcode.com/problems/valid-parentheses/",
    "tags": ["String", "Stack"],
    "patterns": ["Stack"],
    "companies": ["Google", "Amazon", "Microsoft", "Facebook", "Apple"],
    "dateAdded": "2023-01-20",
    "description": "Given a string s containing just the characters '(', ')', '{', '}', '[' and ']', determine if the input string is valid."
  },
  {
    "id": 22,
    "title": "Generate Parentheses",
    "difficulty": "Medium",
    "url": "https://leetcode.com/problems/generate-parentheses/",
    "tags": ["String", "Dynamic Programming", "Backtracking"],
    "patterns": ["Backtracking", "DFS"],
    "companies": ["Google", "Amazon", "Microsoft", "Facebook"],
    "dateAdded": "2023-01-22",
    "description": "Given n pairs of parentheses, write a function to generate all combinations of well-formed parentheses."
  },
  {
    "id": 33,
    "title": "Search in Rotated Sorted Array",
    "difficulty": "Medium",
    "url": "https://leetcode.com/problems/search-in-rotated-sorted-array/",
    "tags": ["Array", "Binary Search"],
    "patterns": ["Binary Search", "Modified Binary Search"],
    "companies": ["Google", "Amazon", "Microsoft", "Facebook", "Apple"],
    "dateAdded": "2023-01-33",
    "description": "There is an integer array nums sorted in ascending order. Given the array after a possible rotation and a target value, return the index of target."
  },
  {
    "id": 42,
    "title": "Trapping Rain Water",
    "difficulty": "Hard",
    "url": "https://leetcode.com/problems/trapping-rain-water/",
    "tags": ["Array", "Two Pointers", "Dynamic Programming", "Stack", "Monotonic Stack"],
    "patterns": ["Two Pointers", "Stack"],
    "companies": ["Google", "Amazon", "Microsoft", "Facebook", "Apple"],
    "dateAdded": "2023-01-42",
    "description": "Given n non-negative integers representing an elevation map where the width of each bar is 1, compute how much water it can trap after raining."
  },
  {
    "id": 49,
    "title": "Group Anagrams",
    "difficulty": "Medium",
    "url": "https://leetcode.com/problems/group-anagrams/",
    "tags": ["Array", "Hash Table", "String", "Sorting"],
    "patterns": ["Hash Map", "Sorting"],
    "companies": ["Google", "Amazon", "Microsoft", "Facebook"],
    "dateAdded": "2023-01-49",
    "description": "Given an array of strings strs, group the anagrams together."
  },
  {
    "id": 53,
    "title": "Maximum Subarray",
    "difficulty": "Medium",
    "url": "https://leetcode.com/problems/maximum-subarray/",
    "tags": ["Array", "Divide and Conquer", "Dynamic Programming"],
    "patterns": ["Kadane's Algorithm", "DP"],
    "companies": ["Google", "Amazon", "Microsoft", "LinkedIn", "Bloomberg"],
    "dateAdded": "2023-04-15",
    "description": "Given an integer array nums, find the contiguous subarray (containing at least one number) which has the largest sum and return its sum."
  },
  {
    "id": 56,
    "title": "Merge Intervals",
    "difficulty": "Medium",
    "url": "https://leetcode.com/problems/merge-intervals/",
    "tags": ["Array", "Sorting"],
    "patterns": ["Merge Intervals", "Sorting"],
    "companies": ["Google", "Amazon", "Microsoft", "Facebook", "Apple"],
    "dateAdded": "2023-01-56",
    "description": "Given an array of intervals where intervals[i] = [starti, endi], merge all overlapping intervals."
  },
  {
    "id": 70,
    "title": "Climbing Stairs",
    "difficulty": "Easy",
    "url": "https://leetcode.com/problems/climbing-stairs/",
    "tags": ["Math", "Dynamic Programming", "Memoization"],
    "patterns": ["DP", "Fibonacci"],
    "companies": ["Google", "Amazon", "Adobe", "Apple"],
    "dateAdded": "2023-05-01",
    "description": "You are climbing a staircase. It takes n steps to reach the top. Each time you can either climb 1 or 2 steps. In how many distinct ways can you climb to the top?"
  },
  {
    "id": 76,
    "title": "Minimum Window Substring",
    "difficulty": "Hard",
    "url": "https://leetcode.com/problems/minimum-window-substring/",
    "tags": ["Hash Table", "String", "Sliding Window"],
    "patterns": ["Sliding Window", "Hash Map"],
    "companies": ["Google", "Amazon", "Microsoft", "Facebook", "Uber"],
    "dateAdded": "2023-01-76",
    "description": "Given two strings s and t of lengths m and n respectively, return the minimum window substring of s such that every character in t is included in the window."
  },
  {
    "id": 88,
    "title": "Merge Sorted Array",
    "difficulty": "Easy",
    "url": "https://leetcode.com/problems/merge-sorted-array/",
    "tags": ["Array", "Two Pointers", "Sorting"],
    "patterns": ["Two Pointers", "Merge"],
    "companies": ["Google", "Amazon", "Microsoft", "Facebook", "Apple"],
    "dateAdded": "2023-01-88",
    "description": "You are given two integer arrays nums1 and nums2, sorted in non-decreasing order, and two integers m and n."
  },
  {
    "id": 102,
    "title": "Binary Tree Level Order Traversal",
    "difficulty": "Medium",
    "url": "https://leetcode.com/problems/binary-tree-level-order-traversal/",
    "tags": ["Tree", "Breadth-First Search", "Binary Tree"],
    "patterns": ["BFS", "Level Order Traversal"],
    "companies": ["Google", "Amazon", "Microsoft", "Facebook", "Apple"],
    "dateAdded": "2023-01-102",
    "description": "Given the root of a binary tree, return the level order traversal of its nodes' values."
  },
  {
    "id": 121,
    "title": "Best Time to Buy and Sell Stock",
    "difficulty": "Easy",
    "url": "https://leetcode.com/problems/best-time-to-buy-and-sell-stock/",
    "tags": ["Array", "Dynamic Programming"],
    "patterns": ["Kadane's Algorithm", "DP"],
    "companies": ["Google", "Amazon", "Microsoft", "Facebook", "Apple"],
    "dateAdded": "2023-02-15",
    "description": "You are given an array prices where prices[i] is the price of a given stock on the ith day."
  },
  {
    "id": 124,
    "title": "Binary Tree Maximum Path Sum",
    "difficulty": "Hard",
    "url": "https://leetcode.com/problems/binary-tree-maximum-path-sum/",
    "tags": ["Dynamic Programming", "Tree", "Depth-First Search", "Binary Tree"],
    "patterns": ["DFS", "Tree Traversal", "DP"],
    "companies": ["Google", "Amazon", "Microsoft", "Facebook"],
    "dateAdded": "2023-01-124",
    "description": "A path in a binary tree is a sequence of nodes where each pair of adjacent nodes in the sequence has an edge connecting them."
  },
  {
    "id": 125,
    "title": "Valid Palindrome",
    "difficulty": "Easy",
    "url": "https://leetcode.com/problems/valid-palindrome/",
    "tags": ["Two Pointers", "String"],
    "patterns": ["Two Pointers"],
    "companies": ["Google", "Amazon", "Microsoft", "Facebook", "Apple"],
    "dateAdded": "2023-01-125",
    "description": "A phrase is a palindrome if, after converting all uppercase letters into lowercase letters and removing all non-alphanumeric characters, it reads the same forward and backward."
  },
  {
    "id": 139,
    "title": "Word Break",
    "difficulty": "Medium",